regulation_id,section_id,requirement_id,paragraph,text,word_count
MAS-626,MAS-626-S8,MAS-626-8.6,8.6,"For the purposes of paragraph 8.5, circumstances where a customer presents or may present a higher risk for money laundering or terrorism financing include but are not limited to the following: 24 (a) where a customer or any beneficial owner of the customer is from or in a country or jurisdiction in relation to which the FATF has called for countermeasures, the bank shall treat any business relations with or transactions for any such customer as presenting a higher risk for money laundering or terrorism financing; (b) where a customer or any beneficial owner of the customer is from or in a country or jurisdiction known to have inadequate AML/CFT measures, as determined by the bank for itself, or notified to banks generally by the Authority or other foreign regulatory authorities, the bank shall assess whether any such customer presents a higher risk for money laundering or terrorism financing; and (c) where a customer is a legal person for which the bank is not able to establish if it has any – (i) ongoing, apparent or visible operation or business activity; (ii) economic or business purpose for its corporate structure or arrangement; or (iii) substantive financial activity in its interactions with the bank, the bank shall assess whether any such customer presents a higher risk for money laundering or terrorism financing.",221
MAS-626,MAS-626-S8,MAS-626-8.7,8.7,"A bank shall perform the appropriate enhanced CDD measures in paragraph 8.3 for business relations with or transactions for any customer - (a) who the bank determines under paragraph 8.5; or (b) the Authority or other relevant authorities in Singapore notify to the bank, as presenting a higher risk for money laundering or terrorism financing.",55
MAS-626,MAS-626-S8,MAS-626-8.8,8.8,"A bank shall, in taking enhanced CDD measures to manage and mitigate any higher risks that have been identified by the bank, or notified to it by the Authority or other relevant authorities in Singapore, ensure that the enhanced CDD measures take into account the requirements of any laws, regulations or directions administered by the Authority, including but not limited to the regulations or directions issued by the Authority under section 192 read with section 1 5(1)(b) of the FSM Act , and section 15(1)(a) of the FSM Act, respectively.",90
MAS-626,MAS-626-S8,MAS-626-8.9,8.9,"For the purposes of paragraph 8, a reference to “transaction” shall include a digital token transaction.",16
MAS-626,MAS-626-S9,MAS-626-9.1,9.1,"For the purposes of paragraph 9 – 25 “third party” means – (a) a financial institution set out in Appendix 2; (b) a financial institution which is subject to and supervised by a foreign authority for compliance with AML/CFT requirements consistent with standards set by the FATF (other than a Foreign FI); (c) in relation to a bank incorporated in Singapore, its branches, subsidiaries, parent entity, the branches and subsidiaries of the parent entity, and other related corporations (other than an Entity X); or (d) in relation to a bank incorporated outside Singapore, its head office, its parent entity, the branches and subsidiaries of the head office, the branches and subsidiaries of the parent entity, and other related corporations (other than an Entity X); “Foreign FI” means a financial institution which – (a) is subject to and supervised by a foreign authority for compliance with AML/CFT requirements consistent with standards set by the FATF; (b) holds a licence equivalent to a payment services licence under the PS Act or a digital token service provider licence under the FSM Act; and (c) does not hold any other financial services licence other than the licence mentioned in subparagraph (b); and “Entity X” means an entity which – (a) holds a payment services licence under the PS Act or a digital token service provider licence under the FSM Act, or equivalent licences; and (b) does not hold any other financial services licence other than the licence mentioned in subparagraph (a). [MAS Notice 626 (Amendment) 2025]",252
MAS-626,MAS-626-S9,MAS-626-9.2,9.2,"Subject to paragraph 9.3, a bank may rely on a third party to perform the measures as required by paragraphs 6, 7 and 8 if the following requirements are met: (a) the bank is satisfied that the third party it intends to rely upon is subject to and supervised for compliance with AML/CFT requirements consistent with standards set by the FATF, and has adequate AML/CFT measures in place to comply with those requirements; 26 (b) the bank takes appropriate steps to identify, assess and understand the money laundering and terrorism financing risks particular to the countries or jurisdictions that the third party operates in; (c) the third party is not one which banks have been specifically precluded by the Authority from relying upon; and (d) the third party is able and willing to provide, without delay, upon the bank’s request, any data, documents or information obtained by the third party with respect to the measures applied on the bank’s customer, which the bank would be required or would want to obtain.",171
MAS-626,MAS-626-S9,MAS-626-9.3,9.3,No bank shall rely on a third party to conduct ongoing monitoring of business relations with customers.,17
MAS-626,MAS-626-S9,MAS-626-9.4,9.4,"Where a bank relies on a third party to perform the measures as required by paragraphs 6, 7 and 8, it shall - (a) document the basis for its satisfaction that the requirements in paragraphs 9.2(a) and (b) have been met, except where the third party is a financial institution set out in Appendix 2; and (b) immediately obtain from the third party the CDD information which the third party had obtained.",72
MAS-626,MAS-626-S9,MAS-626-9.5,9.5,"For the avoidance of doubt, notwithstanding the reliance upon a third party, the bank shall remain responsible for its AML/CFT obligations in this Notice.",24
MAS-626,MAS-626-S10,MAS-626-10.1,10.1,Paragraph 10 applies to a bank when it provides correspondent banking or other similar services in Singapore to a bank or financial institution that is operating outside Singapore.,28
MAS-626,MAS-626-S10,MAS-626-10.2,10.2,"For the purposes of paragraph 10 - “correspondent bank” means a bank in Singapore that provides or intends to provide correspondent banking or other similar services; “correspondent banking” means the provision of banking services by a correspondent bank to a respondent bank; “payable-through account” means an account maintained at the correspondent bank by the respondent bank but which is accessible directly by a third party to effect transactions on its own behalf; “respondent financial institution” means a bank or financial institution, outside Singapore to which correspondent banking or other similar services are provided; 27 “shell financial institution” means a bank or financial institution incorporated, formed or established in a country or jurisdiction where the bank or financial institution has no physical presence, and which is unaffiliated with a financial group that is subject to effective consolidated supervision; and “similar services” include services undertaken for securities transactions, funds transfers or digital token transactions, for the financial institution that is operating outside Singapore, whether as principal or for its customers.",168
MAS-626,MAS-626-S10,MAS-626-10.3,10.3,"A bank in Singapore shall perform the following measures, in addition to the measures as required by paragraphs 6, 7 and 8, when providing correspondent banking or other similar services: (a) assess the suitability of the respondent financial institution by taking the following steps: (i) gather adequate information about the respondent financial institution to understand fully the nature of the respondent financial institution’s business, including making appropriate inquiries on its management, its major business activities and the countries or jurisdict ions in which it operates; (ii) determine from any available sources the reputation of the respondent financial institution and the quality of supervision over the respondent financial institution, including whether it has been the subject of money laundering or terrorism financing investigation or regulatory action; and (iii) assess the respondent financial institution’s AML/CFT controls and ascertain that they are adequate and effective, having regard to the AML/CFT measures of the country or jurisdiction in which the respondent financial institution operates; (b) clearly understand and document the respective AML/CFT responsibilities of each financial institution; and (c) obtain approval from the bank’s senior management before providing correspondent banking or similar services to a new financial institution.",194
MAS-626,MAS-626-S10,MAS-626-10.4,10.4,"Where the correspondent banking or other similar services involve a payable -through account, the correspondent bank shall be satisfied that - (a) the respondent financial institution has performed appropriate measures at least equivalent to those specified in paragraph 6 on the third party having direct access to the payable-through account; and (b) the respondent financial institution is able to perform ongoing monitoring of its business relations with that third party and is willing and able to provide CDD information to the correspondent bank upon request. 28",86
MAS-626,MAS-626-S10,MAS-626-10.5,10.5,The correspondent bank shall document the basis for its satisfaction that the requirements in paragraphs 10.3 and 10.4 are met.,20
MAS-626,MAS-626-S10,MAS-626-10.6,10.6,"No bank shall enter into or continue correspondent banking or other similar services relationship with another bank or financial institution that does not have adequate controls against money laundering or terrorism financing activities, is not effectively supervised by the relevant authorities or is a shell financial institution.",47
MAS-626,MAS-626-S10,MAS-626-10.7,10.7,"A bank shall also take appropriate measures when establishing correspondent banking or other similar services relationship, to satisfy itself that its respondent financial institutions do not permit their accounts to be used by shell financial institutions.",36
MAS-626,MAS-626-S11,MAS-626-11.1,11.1,Paragraph 11 shall apply to a bank when it effects the sending of funds by wire transfer or when it receives funds (including serial payments and cover payments) by wire transfer on the account of the wire transfer originator or the wire transfer beneficiary but shall not apply to a transfer and settlement between the bank and another financial institution where the bank and the other financial institution are acting on their own behalf as the wire transfer originator and the wire transfer beneficiary.,84
MAS-626,MAS-626-S11,MAS-626-11.2,11.2,"For the purposes of paragraph 11 - “batch transfer” means a transfer comprising a number of individual wire transfers that are sent by a wire transfer originator to the same financial institutions, irrespective of whether the individual wire transfers are intended ultimately for one or more wire transfer beneficiaries; “cover payment” means a wire transfer that combines a payment message sent directly by the ordering institution to the beneficiary institution with the routing of the funding instruction from the ordering institution to the beneficiary institution through one or more intermediary institutions; “intermediary institution” means the financial institution in a serial payment or cover payment chain that receives and transmits a wire transfer on behalf of the ordering institution and the beneficiary institution, or another intermediary institution; “serial payment” means a direct sequential chain of payment where the wire transfer and accompanying payment message travel together from the ordering institution to the beneficiary institution, directly or through one or more intermediary institutions; “straight-through processing” means payment transactions that are conducted electronically without the need for manual intervention; “unique transaction reference number” means a combination of letters, numbers or symbols, determined by the payment service provider in accordance with the protocols 29 of the payment and settlement system or messaging system used for the wire transfer, and which permits the traceability of the wire transfer; “wire transfer beneficiary” means the natural person, legal person or legal arrangement who is identified by the wire transfer originator as the receiver of the wire transfer funds; and “wire transfer originator” means the account holder who allows the wire transfer from that account, or where there is no account, the natural person, legal person or legal arrangement that places the wire transfer order with the ordering institution to perform the wire transfer. Responsibility of the Ordering Institution (I) Identification and Recording of Information",307
MAS-626,MAS-626-S11,MAS-626-11.3,11.3,"Before effecting a wire transfer, every bank that is an ordering institution shall - (a) identify the wire transfer originator and verify the wire transfer originator’s identity, as the case may be (if the bank has not already done so by virtue of paragraph 6); and (b) record adequate details of the wire transfer so as to permit its reconstruction, including but not limited to, the date of the wire transfer, the type and amount of currency transferred and the value date. (II) Cross-Border Wire Transfers Below or Equal To S$1,500",91
MAS-626,MAS-626-S11,MAS-626-11.4,11.4,"In a cross-border wire transfer where the amount to be transferred is below or equal to S$1,500, every bank which is an ordering institution shall include in the message or payment instruction that accompanies or relates to the wire transfer the following: (a) the name of the wire transfer originator; (b) the wire transfer originator’s account number (or unique transaction reference number where no account number exists); (c) the name of the wire transfer beneficiary; and (d) the wire transfer beneficiary’s account number (or unique transaction reference number where no account number exists). (III) Cross-border Wire Transfers Exceeding S$1,500",99
MAS-626,MAS-626-S11,MAS-626-11.5,11.5,"In a cross -border wire transfer where the amount to be transferred exceeds S$1,500, every bank which is an ordering institution shall include in the message or payment instruction that accompanies or relates to the wire transfer the information requi red by paragraphs 11.4(a) to 11.4(d) and any of the following: 30 (a) the wire transfer originator’s - (i) residential address; or (ii) registered or business address, and if different, principal place of business, as may be appropriate; (b) the wire transfer originator’s unique identification number (such as an identity card number, birth certificate number or passport number, or where the wire transfer originator is not a natural person, the incorporation number or business registration number); or (c) the date and place of birth, incorporation or registration of the wire transfer originator (as may be appropriate).",136
MAS-626,MAS-626-S11,MAS-626-11.6,11.6,"Where several individual cross-border wire transfers from a single wire transfer originator are bundled in a batch file for transmission to wire transfer beneficiaries, a bank shall ensure that the batch transfer file contains - (a) the wire transfer originator information required by paragraph 11.57 and which has been verified; and (b) the wire transfer beneficiary information required by paragraph 11.58, which are fully traceable within the beneficiary country or jurisdiction. (IV) Domestic Wire Transfers",75
MAS-626,MAS-626-S11,MAS-626-11.7,11.7,"In a domestic wire transfer, every bank that is an ordering institution shall either – (a) include in the message or payment instruction that accompanies or relates to the wire transfer the following: (i) the name of the wire transfer originator; (ii) the wire transfer originator’s account number (or unique transaction reference number where no account number exists); and (iii) any of the following: (A) the wire transfer originator’s: (1) residential address; or 7 Please note the references to paragraphs 11.4(a) and (b) in paragraph 11.5. 8 Please note the references to paragraphs 11.4(c) and (d) in paragraph 11.5. 31 (2) registered or business address, and if different, principal place of business, as may be appropriate; (B) the wire transfer originator’s unique national identification number (such as an identity card number, birth certificate number or passport number, or where the wire transfer originator is not a natural person, the incorporation number or business reg istration number); (C) the date and place of birth, incorporation or registration of the wire transfer originator (as may be appropriate); or (b) include only the wire transfer originator’s account number (or unique transaction reference number where no account number exists), provided - (i) that these details will permit the transaction to be traced back to the wire transfer originator and wire transfer beneficiary; (ii) the ordering institution shall provide the wire transfer originator information set out in paragraph 11.7(a) within 3 business days of a request for such information by the beneficiary institution, by the Authority or other relevant authorities in Singapore; and (iii) the ordering institution shall provide the wire transfer originator information set out in paragraph 11.7(a) immediately upon request for such information by law enforcement authorities in Singapore.",286
MAS-626,MAS-626-S11,MAS-626-11.8,11.8,All wire transfer originator and beneficiary information collected by the ordering institution shall be documented.,15
MAS-626,MAS-626-S11,MAS-626-11.9,11.9,Where the ordering institution is unable to comply with the requirements in paragraphs,13
MAS-626,MAS-626-S11,MAS-626-11.3,11.3,"to 11.8, it shall not execute the wire transfer. Responsibility of the Beneficiary Institution",14
MAS-626,MAS-626-S11,MAS-626-11.10,11.10,"A bank that is a beneficiary institution shall take reasonable measures, including post - event monitoring or real -time monitoring where feasible, to identify cross -border wire transfers that lack the required wire transfer originator or required wire transfer beneficiary information.",41
MAS-626,MAS-626-S11,MAS-626-11.11,11.11,"For cross -border wire transfers, a beneficiary institution shall identify and verify the identity of the wire transfer beneficiary if the identity has not been previously verified.",27
MAS-626,MAS-626-S11,MAS-626-11.12,11.12,"A bank that is a beneficiary institution shall implement appropriate internal risk -based policies, procedures and controls for determining - 32 (a) when to execute, reject, or suspend a wire transfer lacking required wire transfer originator or wire transfer beneficiary information; and (b) the appropriate follow-up action. Responsibility of the Intermediary Institution",52
MAS-626,MAS-626-S11,MAS-626-11.13,11.13,A bank that is an intermediary institution shall retain all the required wire transfer originator and wire transfer beneficiary information accompanying the wire transfer.,24
MAS-626,MAS-626-S11,MAS-626-11.14,11.14,"Where technical limitations prevent the required wire transfer originator or wire transfer beneficiary information accompanying a cross-border wire transfer from remaining with a related domestic wire transfer, a record shall be kept, for at least five years, by the receiving intermediary institution of all the information received from the ordering institution or another intermediary institution.",55
MAS-626,MAS-626-S11,MAS-626-11.15,11.15,"An intermediary institution shall take reasonable measures, which are consistent with straight-through processing, to identify cross-border wire transfers that lack the required wire transfer originator or wire transfer beneficiary information.",30
