regulation_id,section_id,requirement_id,paragraph,text,word_count
MAS-626,MAS-626-S6,MAS-626-6.14C,6.14C,"Where the bank – (a) has assessed that the money laundering and terrorism financing risks in relation to the customer are not high; and (b) is unable to obtain the unique identification number and/or residential address of the beneficial owner after taking reasonable measures, the bank may obtain the date of birth and nationality of the beneficial owner, in lieu of the unique identification number, and the business address of the beneficial owner, in lieu of the residential address. [MAS Notice 626 (Amendment) 2025]",84
MAS-626,MAS-626-S6,MAS-626-6.14D,6.14D,The bank shall document the results of the assessment in paragraph 6.14C(a) and all the measures taken under paragraph 6.14C(b). [MAS Notice 626 (Amendment) 2025],25
MAS-626,MAS-626-S6,MAS-626-6.15,6.15,"Where the customer is not a natural person, the bank shall understand the nature of the customer’s business and its ownership and control structure.",24
MAS-626,MAS-626-S6,MAS-626-6.16,6.16,"A bank shall not be required to inquire if there exists any beneficial owner in relation to a customer that is - (a) an entity listed and traded on the Singapore Exchange; (b) an entity listed on a stock exchange outside of Singapore that is subject to – (i) regulatory disclosure requirements; and (ii) requirements relating to adequate transparency in respect of its beneficial owners (imposed through stock exchange rules, law or other enforceable means); (c) a financial institution set out in Appendix 1; (d) a financial institution incorporated or established outside Singapore that is subject to and supervised for compliance with AML/CFT requirements consistent with standards set by the FATF; or 15 (e) an investment vehicle where the managers are financial institutions 6 - (i) set out in Appendix 1; or (ii) incorporated or established outside Singapore but are subject to and supervised for compliance with AML/CFT requirements consistent with standards set by the FATF, unless the bank has doubts about the veracity of the CDD information, or suspects that the customer, business relations with, or transaction for the customer, may be connected with money laundering or terrorism financing.",190
MAS-626,MAS-626-S6,MAS-626-6.17,6.17,"For the purposes of paragraphs 6.16(d) and 6.16(e)(ii), a bank shall document the basis for its determination that the requirements in those paragraphs have been duly met. (IVA) Identification of Beneficiary",31
MAS-626,MAS-626-S6,MAS-626-6.17A,6.17A,Paragraphs 6.17B and 6.17C shall apply where a bank distributes life policies on behalf of a direct life insurer licensed under section 11 of the Insurance Act 1966.,28
MAS-626,MAS-626-S6,MAS-626-6.17B,6.17B,"A bank shall, as soon as a beneficiary of a life policy is identified to the bank as a specifically named natural person, legal person or legal arrangement, obtain the full name, including any aliases, of such beneficiary.",38
MAS-626,MAS-626-S6,MAS-626-6.17C,6.17C,"A bank shall, as soon as a beneficiary of a life policy is designated by characteristics, class or other means and is known to the bank, obtain sufficient information concerning the beneficiary to satisfy the direct life insurer that such direct lif e insurer will be able to establish the identity of the beneficiary at the time of payout. (V) Information on the Purpose and Intended Nature of Business Relations and Transaction Undertaken without an Account Being Opened",78
MAS-626,MAS-626-S6,MAS-626-6.18,6.18,"A bank shall, when processing the application to establish business relations, or undertaking a transaction without an account being opened, understand and as appropriate, obtain from the customer information as to the purpose and intended nature of business relations. (VI) Ongoing Monitoring",42
MAS-626,MAS-626-S6,MAS-626-6.19,6.19,"A bank shall monitor on an ongoing basis, its business relations with customers.",13
MAS-626,MAS-626-S6,MAS-626-6.20,6.20,"A bank shall, during the course of business relations with a customer, observe the conduct of the customer’s account and scrutinise transactions undertaken throughout the course of business relations, to ensure that the transactions are consistent with the bank’s knowledge of the customer, its business and risk profile and where appropriate, the 6 For the avoidance of doubt, the bank shall be required to inquire if there exists any beneficial owners in relation to a customer that is an investment vehicle to which it provides the regulated activity of fund management as the primary manager, except where the interests in the investment vehicle are distributed by a financial institution as described in paragraphs 6.16 (c) or 6.16(d). 16 source of funds. If a bank is participating in COSMIC and receives , through COSMIC, information relating to a customer, its business, risk profile or source of funds, the bank’s knowledge of the customer, its business and risk profile and, if appropriate, the source of funds, must include the information received through COSMIC.",171
MAS-626,MAS-626-S6,MAS-626-6.20A,6.20A,A bank shall perform enhanced risk mitigation measures where the transaction involves a transfer of a digital token to or a receipt of a digital token from an entity other than: (a) a financial institution as defined in section 2 of the FSM Act; or (b) a financial institution incorporated or established outside Singapore that is subject to and supervised for compliance with AML/CFT requirements consistent with standards set by the FATF.,72
MAS-626,MAS-626-S6,MAS-626-6.21,6.21,"A bank shall pay special attention to all complex, unusually large or unusual patterns of transactions, undertaken throughout the course of business relations, that have no apparent or visible economic or lawful purpose. If a bank is participating in COSMIC, the bank must take into account information that it has received through COSMIC, in determining whether transactions undertaken throughout the course of business relations are complex, unusually large or part of an un usual pattern of transactions that have no apparent or visible economic or lawful purpose.",87
MAS-626,MAS-626-S6,MAS-626-6.22,6.22,"For the purposes of ongoing monitoring, a bank shall put in place and implement adequate systems and processes, commensurate with the size and complexity of the bank, to – (a) monitor its business relations with customers; and (b) detect and report suspicious, complex, unusually large or unusual patterns of transactions.",50
MAS-626,MAS-626-S6,MAS-626-6.23,6.23,"A bank shall, to the extent possible, inquire into the background and purpose of the transactions in paragraph 6.21 and document its findings with a view to making this information available to the relevant authorities should the need arise.",39
MAS-626,MAS-626-S6,MAS-626-6.24,6.24,"A bank shall ensure that the CDD data, documents and information obtained in respect of customers, natural persons appointed to act on behalf of the customers, connected parties of the customers and beneficial owners of the customers, are relevant and kept up-to-date by undertaking reviews of existing CDD data, documents and in formation, particularly for higher risk categories of customers.",60
MAS-626,MAS-626-S6,MAS-626-6.25,6.25,"Where there are any reasonable grounds for suspicion that existing business relations with a customer are connected with money laundering or terrorism financing, and where the bank considers it appropriate to retain the customer - (a) the bank shall substantiate and document the reasons for retaining the customer; and 17 (b) the customer’s business relations with the bank shall be subject to commensurate risk mitigation measures, including enhanced ongoing monitoring.",70
MAS-626,MAS-626-S6,MAS-626-6.26,6.26,"Where the bank assesses the customer or the business relations with the customer referred to in paragraph 6.25 to be of higher risk, the bank shall perform enhanced CDD measures, which shall include obtaining the approval of the bank’s senior managem ent to retain the customer. CDD Measures for Non-Face-to-Face Business Relations",52
MAS-626,MAS-626-S6,MAS-626-6.27,6.27,A bank shall develop policies and procedures to address any specific risks associated with non-face-to-face business relations with a customer or transactions for a customer.,25
MAS-626,MAS-626-S6,MAS-626-6.28,6.28,A bank shall implement the policies and procedures referred to in paragraph 6.27 when establishing business relations with a customer and when conducting ongoing due diligence.,26
MAS-626,MAS-626-S6,MAS-626-6.29,6.29,"Where there is no face-to-face contact, the bank shall perform CDD measures that are at least as robust as those that would be required to be performed if there was face-to-face contact. Reliance by Acquiring Bank on Measures Already Performed",40
MAS-626,MAS-626-S6,MAS-626-6.30,6.30,"When a bank (“acquiring bank”) acquires, either in whole or in part, the business of another financial institution (whether in Singapore or elsewhere), the acquiring bank shall perform the measures as required by paragraphs 6, 7 and 8, on the custome rs acquired with the business at the time of acquisition except where the acquiring bank has – (a) acquired at the same time all corresponding customer records (including CDD information) and has no doubt or concerns about the veracity or adequacy of the information so acquired; and (b) conducted due diligence enquiries that have not raised any doubt on the part of the acquiring bank as to the adequacy of AML/CFT measures previously adopted in relation to the business or part thereof now acquired by the acquiring bank and document such enquiries. CDD Measures for Non-Account Holder",138
MAS-626,MAS-626-S6,MAS-626-6.31,6.31,"A bank that undertakes any transaction of a value exceeding S$20,000, other than any digital token transaction referred to in paragraph 6.31A, or effects or receives any funds by domestic wire transfer, or by cross-border wire transfer that exceeds S$1,500, for any customer who does not otherwise have business relations with the bank shall – (a) perform CDD measures as if the customer had applied to the bank to establish business relations; and (b) record adequate details of the transaction so as to permit the reconstruction of the transaction, including the nature and date of the transaction, the type and 18 amount of currency involved, the value date, and the details of the payee or beneficiary.",116
MAS-626,MAS-626-S6,MAS-626-6.31A,6.31A,"A bank that undertakes any digital token transaction, or effects or receives any digital token by value transfer, for any customer who does not otherwise have business relations with the bank shall – (a) perform CDD measures as if the customer had applied to the bank to establish business relations; and (b) record adequate details of the digital token transaction so as to permit the reconstruction of the transaction, including the nature and date of the transaction, the type and amount of currency, the type and value of digital token(s) involved, the value date, and the details of the payee or beneficiary. Timing for Verification",105
MAS-626,MAS-626-S6,MAS-626-6.32,6.32,"Subject to paragraphs 6.33 and 6.34, a bank shall complete verification of the identity of a customer as required by paragraph 6.9, natural persons appointed to act on behalf of the customer as required by paragraph 6.10(b) and beneficial owners of the customer as required by paragraph 6.14B - (a) before the bank establishes business relations with the customer; (b) before the bank undertakes any transaction of a value exceeding S$20,000 for the customer, other than any digital token transaction referred to in paragraph 6.32(d), where the customer has not otherwise established business relations with the bank; (c) before the bank effects or receives any funds by domestic wire transfer, or by cross-border wire transfer that exceeds S$1,500, for any customer who has not otherwise established business relations with the bank; (d) before the bank undertakes any digital token transaction, where the customer has not otherwise established business relations with the bank; or (e) before the bank effects or receives any digital token by value transfer, for any customer who has not otherwise established business relations with the bank. [MAS Notice 626 (Amendment) 2025]",184
MAS-626,MAS-626-S6,MAS-626-6.33,6.33,"A bank may establish business relations with a customer before completing the verification of the identity of the customer as required by paragraph 6.9, natural persons appointed to act on behalf of the customer as required by paragraph 6.10(b) and beneficial owners of the customer as required by paragraph 6.14B if – (a) the deferral of completion of the verification is essential in order not to interrupt the normal conduct of business operations; and 19 (b) the risks of money laundering and terrorism financing can be effectively managed by the bank. [MAS Notice 626 (Amendment) 2025]",96
MAS-626,MAS-626-S6,MAS-626-6.34,6.34,"Where the bank establishes business relations with a customer before verifying the identity of the customer as required by paragraph 6.9, natural persons appointed to act on behalf of the customer as required by paragraph 6.10(b), and beneficial owners of the customer as required by paragraph 6.14B, the bank shall - (a) develop and implement internal risk management policies and procedures concerning the conditions under which such business relations may be established prior to verification; and (b) complete such verification as soon as is reasonably practicable. [MAS Notice 626 (Amendment) 2025] Where Measures are Not Completed",96
MAS-626,MAS-626-S6,MAS-626-6.35,6.35,"Where the bank is unable to complete the measures as required by paragraphs 6, 7 and 8, it shall not commence or continue business relations with any customer or undertake any transaction for any customer. The bank shall consider if the circumstances are suspicious so as to warrant the filing of an STR.",53
MAS-626,MAS-626-S6,MAS-626-6.36,6.36,"For the purposes of paragraph 6.35, completion of the measures means the situation where the bank has obtained, screened and verified (including by delayed verification as allowed under paragraphs 6.33 and 6.34) all necessary CDD information required under paragraphs 6, 7 and 8, and where the bank has received satisfactory responses to all inquiries in relation to such necessary CDD information. Joint Account",63
MAS-626,MAS-626-S6,MAS-626-6.37,6.37,"In the case of a joint account, a bank shall perform CDD measures on all of the joint account holders as if each of them were individual customers of the bank. Existing Customers",33
MAS-626,MAS-626-S6,MAS-626-6.38,6.38,"Where there is any subsequent revision to this Notice resulting in a change in the measures as required under paragraphs 6, 7 and 8, a bank shall perform the measures as required by paragraphs 6, 7 and 8 in relation to its existing customers, based on its own assessment of materiality and risk, taking into account any previous measures applied, the time when the measures were last applie d to such existing customers and the adequacy of data, documents or information obtained. [MAS Notice 626 (Amendment) 2025] Screening 20",89
MAS-626,MAS-626-S6,MAS-626-6.39,6.39,"A bank shall screen a customer, natural persons appointed to act on behalf of the customer, connected parties of the customer and beneficial owners of the customer against relevant money laundering and terrorism financing information sources, as well as li sts and information provided by the Authority or other relevant authorities in Singapore for the purposes of determining if there are any money laundering or terrorism financing risks in relation to the customer.",73
MAS-626,MAS-626-S6,MAS-626-6.40,6.40,"A bank shall screen the persons referred to in paragraph 6.39 - (a) when, or as soon as reasonably practicable after, the bank establishes business relations with a customer; (b) when the bank undertakes any transaction of a value exceeding S$20,000, other than any digital token transaction referred to in paragraph 6.40(f), for a customer who has not otherwise established business relations with the bank; (c) when the bank effects or receives any funds by domestic wire transfer, or by cross-border wire transfer that exceeds S$1,500, for a customer who has not otherwise established business relations with the bank; (d) on a periodic basis after the bank establishes business relations with the customer; (e) when there are any changes or updates to - (i) the lists and information provided by the Authority or other relevant authorities in Singapore to the bank; or (ii) the natural persons appointed to act on behalf of a customer, connected parties of a customer or beneficial owners of a customer, (f) when the bank undertakes any digital token transaction for a customer who has not otherwise established business relations with the bank; and (g) when the bank effects or receives any digital token by value transfer, for a customer who has not otherwise established business relations with the bank.",214
MAS-626,MAS-626-S6,MAS-626-6.41,6.41,"A bank shall screen all wire transfer originators and wire transfer beneficiaries as defined in paragraph 11, against lists and information provided by the Authority or any other relevant authorities in Singapore for the purposes of determining if th ere are any money laundering or terrorism financing risks in relation to any such persons.",54
MAS-626,MAS-626-S6,MAS-626-6.41A,6.41A,"A bank shall screen all value transfer originators and value transfer beneficiaries as defined in paragraph 11A, against lists and information provided by the Authority and any other relevant authorities in Singapore for the purposes of determining i f there are any money laundering or terrorism financing risks in relation to any such persons.",54
MAS-626,MAS-626-S6,MAS-626-6.42,6.42,The results of screening and assessment by the bank shall be documented. 21,13
MAS-626,MAS-626-S6,MAS-626-6.43,6.43,"For the purposes of paragraph 6 – (a) a reference to “transaction” shall include a digital token transaction; and (b) a reference to “lists and information provided by the Authority and other relevant authorities in Singapore” does not include the platform screening list, as defined in MAS Notice FSM-N02 on Prevention of Money Laundering and Countering of Financing of Terrorism – Financial Institutions’ Information Sharing Platform.",66
MAS-626,MAS-626-S7,MAS-626-7.1,7.1,"Subject to paragraph 7.4, a bank may perform simplified CDD measures in relation to a customer, any natural person appointed to act on behalf of the customer and any beneficial owner of the customer (other than any beneficial owner that the bank is exempted from making inquiries about under paragraph 6.16) if it is satisfied that the risks of money laundering and terrorism financing are low.",66
MAS-626,MAS-626-S7,MAS-626-7.2,7.2,The assessment of low risks shall be supported by an adequate analysis of risks by the bank.,17
MAS-626,MAS-626-S7,MAS-626-7.3,7.3,"The simplified CDD measures shall be commensurate with the level of risk, based on the risk factors identified by the bank.",21
MAS-626,MAS-626-S7,MAS-626-7.4,7.4,"A bank shall not perform simplified CDD measures - (a) where a customer or any beneficial owner of the customer is from or in a country or jurisdiction in relation to which the FATF has called for countermeasures; (b) where a customer or any beneficial owner of the customer is from or in a country or jurisdiction known to have inadequate AML/CFT measures, as determined by the bank for itself, or notified to banks generally by the Authority, or other foreign regulatory authorities; or (c) where the bank suspects that money laundering or terrorism financing is involved.",97
MAS-626,MAS-626-S7,MAS-626-7.5,7.5,"Subject to paragraphs 7.2, 7.3 and 7.4, a bank may perform simplified CDD measures in relation to a customer that is a financial institution set out in Appendix 2.",29
MAS-626,MAS-626-S7,MAS-626-7.6,7.6,"Where the bank performs simplified CDD measures in relation to a customer, any natural person appointed to act on behalf of the customer and any beneficial owner of the customer, it shall document - (a) the details of its risk assessment; and (b) the nature of the simplified CDD measures. 22",51
MAS-626,MAS-626-S7,MAS-626-7.7,7.7,"For avoidance of doubt, the term “CDD measures” in paragraph 7 means the measures required by paragraph 6.",18
MAS-626,MAS-626-S8,MAS-626-8.1,8.1,"For the purposes of paragraph 8 - “close associate” means a natural person who is closely connected to a politically exposed person, either socially or professionally; “domestic politically exposed person” means a natural person who is or has been entrusted domestically with prominent public functions; “family member” means a parent, step -parent, child, step -child, adopted child, spouse, sibling, step-sibling and adopted sibling of the politically exposed person; “foreign politically exposed person” means a natural person who is or has been entrusted with prominent public functions in a foreign country or jurisdiction; “international organisation” means an entity established by formal political agreements between member countries or jurisdictions that have the status of international treaties, whose existence is recognised by law in member countries or jurisdictions and which is not treated as a resident institutional unit of the country or jurisdiction in which it is located; “international organisation politically exposed person” means a natural person who is or has been entrusted with prominent public functions in an international organisation; “politically exposed person” means a domestic politically exposed person, foreign politically exposed person or international organisation politically exposed person; and “prominent public functions” includes the roles held by a head of state, a head of government, government ministers, senior civil or public servants, senior judicial or military officials, senior executives of state owned corporations, senior political par ty officials, members of the legislature and senior management of international organisations.",237
MAS-626,MAS-626-S8,MAS-626-8.2,8.2,"A bank shall implement appropriate internal risk management systems, policies, procedures and controls to determine if a customer, any natural person appointed to act on behalf of the customer, any connected party of the customer or any beneficial own er of the customer is a politically exposed person, or a family member or close associate of a politically exposed person. If a bank is participating in COSMIC, the bank must ensure that under its internal risk management systems, policies, procedures and controls in this paragraph 8.2, the bank takes into account information relating to the aforementioned persons that it has received through COSMIC. 23",104
MAS-626,MAS-626-S8,MAS-626-8.3,8.3,"A bank shall, in addition to performing CDD measures (specified in paragraph 6), perform at least the following enhanced CDD measures where a customer or any beneficial owner of the customer is determined by the bank to be a politically exposed person , or a family member or close associate of a politically exposed person under paragraph 8.2: (a) obtain approval from the bank’s senior management to establish or continue business relations with, or undertake any transaction without an account being opened for the customer; (b) establish, by appropriate and reasonable means, the source of wealth and source of funds of the customer and any beneficial owner of the customer; and (c) conduct, during the course of business relations with the customer, enhanced monitoring of business relations with the customer. In particular, the bank shall increase the degree and nature of monitoring of the business relations with and transactions for the customer, in order to determine whether they appear unusual or suspicious.",162
MAS-626,MAS-626-S8,MAS-626-8.4,8.4,"A bank may adopt a risk -based approach in determining whether to perform enhanced CDD measures or the extent of enhanced CDD measures to be performed for - (a) domestic politically exposed persons, their family members and close associates; (b) international organisation politically exposed persons, their family members and close associates; or (c) politically exposed persons who have stepped down from their prominent public functions, taking into consideration the level of influence such persons may continue to exercise after stepping down from their prominent public functions, their family members and close associates, except in cases where their business relations or transactions with the bank present a higher risk for money laundering or terrorism financing. Other Higher Risk Categories",118
MAS-626,MAS-626-S8,MAS-626-8.5,8.5,"A bank shall implement appropriate internal risk management systems, policies, procedures and controls to determine if business relations with or transactions for any customer present a higher risk for money laundering or terrorism financing. If a bank is participating in COSMIC, the bank must ensure that under its internal risk management systems, policies, procedures and controls in this paragraph 8.5, the bank takes into account information relating to a customer, a natural person appointed to act on behalf of the customer, a connected party of the customer or a beneficial owner of the customer, where relevant, that it has received through COSMIC.",102
